{
  "$id": "integrations.actionBinding",
  "name": "Action Binding",
  "version": "0.11.0",
  "status": "stable",
  "domain": "integrations",
  "category": "mapping",
  "description": "Binds a canonical workflow/event to a registered provider action.",
  "purpose": "Supports controlled external actions such as send email or upsert CRM record.",
  "integrationModel": {
    "kind": "binding",
    "customerManaged": false,
    "containsPersonalData": false,
    "publicEligible": false,
    "supportsRevision": false,
    "dataSensitivity": "internal"
  },
  "fields": [
    {
      "key": "actionKey",
      "required": true,
      "nullable": false,
      "description": "Registered provider action.",
      "primitive": "fields.text"
    },
    {
      "key": "trigger",
      "required": true,
      "nullable": false,
      "description": "Canonical trigger/event/workflow key.",
      "primitive": "fields.text"
    },
    {
      "key": "mapping",
      "required": false,
      "nullable": true,
      "description": "Data mapping.",
      "schema": "integrations.dataMapping"
    },
    {
      "key": "resource",
      "required": false,
      "nullable": true,
      "description": "Target resource.",
      "schema": "integrations.resourceReference"
    },
    {
      "key": "enabled",
      "required": true,
      "nullable": false,
      "description": "Whether binding is enabled.",
      "primitive": "fields.boolean"
    }
  ],
  "relationships": [
    {
      "type": "composes",
      "target": "integrations.dataMapping",
      "description": "Uses the referenced canonical contract."
    },
    {
      "type": "composes",
      "target": "integrations.resourceReference",
      "description": "Uses the referenced canonical contract."
    }
  ],
  "validationRules": [
    {
      "id": "registeredActionOnly",
      "description": "Action must exist on connector definition."
    },
    {
      "id": "triggerCanonical",
      "description": "Trigger resolves to canonical event/workflow vocabulary."
    },
    {
      "id": "consentAndPermissionsStillApply",
      "description": "Binding does not bypass consent or authorization."
    }
  ],
  "cms": {
    "label": "Action Binding",
    "icon": "fa-plug",
    "customerVisible": false,
    "adminVisible": true,
    "editorMode": "integration-schema",
    "defaultPlacement": "integrations",
    "summaryFields": [
      "actionKey",
      "trigger",
      "mapping",
      "resource"
    ],
    "primaryActions": [
      "view"
    ]
  },
  "delivery": {
    "publicAllowed": false,
    "notes": "Only explicitly public-eligible fields may enter client/runtime configuration; secrets and privileged operational metadata remain server-side."
  },
  "futureBindings": {
    "events": "phase-13",
    "webhooks": "phase-14",
    "permissions": "phase-15",
    "siteManifest": "phase-16",
    "api": "phase-18",
    "privacy": "phase-30"
  },
  "examples": {
    "valid": [],
    "invalid": []
  },
  "notes": []
}
