{
  "$id": "integrations.credentialReference",
  "name": "Credential Reference",
  "version": "0.11.0",
  "status": "stable",
  "domain": "integrations",
  "category": "authentication",
  "description": "Reference to one protected credential set.",
  "purpose": "Groups an authentication mechanism with protected secret references and non-secret account context.",
  "integrationModel": {
    "kind": "credential-reference",
    "customerManaged": false,
    "containsPersonalData": false,
    "publicEligible": false,
    "supportsRevision": false,
    "dataSensitivity": "secret"
  },
  "fields": [
    {
      "key": "credentialId",
      "required": true,
      "nullable": false,
      "description": "Credential record ID.",
      "primitive": "fields.text"
    },
    {
      "key": "authType",
      "required": true,
      "nullable": false,
      "description": "Authentication type.",
      "primitive": "fields.select",
      "config": {
        "options": [
          "none",
          "oauth2",
          "api-key",
          "bearer",
          "basic",
          "signed",
          "provider-managed"
        ]
      }
    },
    {
      "key": "secretRefs",
      "required": false,
      "nullable": true,
      "description": "Protected secret references.",
      "itemsSchema": "integrations.secretReference"
    },
    {
      "key": "account",
      "required": false,
      "nullable": true,
      "description": "Associated external account.",
      "schema": "integrations.accountReference"
    },
    {
      "key": "expiresAt",
      "required": false,
      "nullable": true,
      "description": "Known credential expiry.",
      "primitive": "fields.dateTime"
    }
  ],
  "relationships": [
    {
      "type": "composesMany",
      "target": "integrations.secretReference",
      "description": "Uses the referenced canonical contract."
    },
    {
      "type": "composes",
      "target": "integrations.accountReference",
      "description": "Uses the referenced canonical contract."
    }
  ],
  "validationRules": [
    {
      "id": "noSecretMaterial",
      "description": "Credential reference does not contain token/password material."
    },
    {
      "id": "expiryHandled",
      "description": "Known expiry should drive reauthorization health state."
    }
  ],
  "cms": {
    "label": "Credential Reference",
    "icon": "fa-plug",
    "customerVisible": false,
    "adminVisible": true,
    "editorMode": "integration-schema",
    "defaultPlacement": "integrations",
    "summaryFields": [
      "credentialId",
      "authType",
      "secretRefs",
      "account"
    ],
    "primaryActions": [
      "view"
    ]
  },
  "delivery": {
    "publicAllowed": false,
    "notes": "Only explicitly public-eligible fields may enter client/runtime configuration; secrets and privileged operational metadata remain server-side."
  },
  "futureBindings": {
    "events": "phase-13",
    "webhooks": "phase-14",
    "permissions": "phase-15",
    "siteManifest": "phase-16",
    "api": "phase-18",
    "privacy": "phase-30"
  },
  "examples": {
    "valid": [],
    "invalid": []
  },
  "notes": []
}
